{
  "$schema": "https://elitea.ai/schemas/brand-pack/1.json",
  "id": "default",
  "version": "1.0.0",
  "product": {
    "name": "Elitea",
    "shortName": "Elitea"
  },
  "assets": {
    "logoFull": "./brand/logo-full.svg",
    "logoMark": "./brand/logo-mark.svg",
    "favicon": "./brand/favicon.svg"
  },
  "typography": {
    "fontFamily": "\"Montserrat\", Roboto, Arial, sans-serif",
    "fontFamilyMono": "\"Roboto Mono\", Consolas, \"Courier New\", monospace",
    "baseSize": 14,
    "scale": 1.2
  },
  "shape": {
    "radiusSm": 4,
    "radiusMd": 8,
    "radiusLg": 16,
    "radiusPill": 9999,
    "density": "comfortable"
  },
  "locale": {
    "default": "en-GB",
    "dateLocale": "en-GB"
  },
  "brand": {
    "hue": "#6ae8fa"
  },
  "schemes": {
    "light": {
      "aiAssistant.iconBackground": "linear-gradient(222.04deg, rgba(104, 177, 255, 0.38) 10.38%, rgba(253, 161, 255, 0.38) 91.15%)",
      "aiAssistant.iconBorder": "linear-gradient(222.04deg, rgba(41, 155, 255, 0.128) 10.38%, rgba(251, 55, 255, 0.64) 91.15%)",
      "aiAssistant.iconGradientEnd": "#5CA0FE",
      "aiAssistant.iconGradientStart": "#F534FF",
      "background.agentModal.background": "linear-gradient(224.97deg, #DEEDFF 0%, #F9DFFE 100%)",
      "background.agentModal.border": "linear-gradient(224.66deg, #8BC9FF 0%, #FDA3FF 99.46%)",
      "background.agentModal.content.background": "rgba(248, 252, 255, 1)",
      "background.agentModal.content.border": "linear-gradient(224.66deg, #8BC9FF 0%, #FDA3FF 99.46%)",
      "background.aiAnswerActions": "linear-gradient(270deg, #FFFFFF 82.5%, rgba(255, 255, 255, 0) 100%)",
      "background.aiAnswerBkg": "#FFFFFF",
      "background.aiParticipantIcon": " rgba(80, 161, 255, 0.2)",
      "background.attention": "rgba(233, 121, 18, 0.05)",
      "background.avatar": "rgba(217, 217, 217, 1)",
      "background.banner.border": "linear-gradient(42.04deg, rgba(246, 172, 102, 1) 8.85%, rgba(215, 128, 255, 1) 89.62%)",
      "background.banner.default": "linear-gradient(30deg, rgba(255, 214, 193, 1) 8.85%, rgba(229, 215, 255, 1) 89.62%)",
      "background.button.agentHub.active": "rgba(201, 189, 255, 0.4)",
      "background.button.agentHub.default": "rgba(201, 189, 255, 0.2)",
      "background.button.agentHub.hover": "rgba(201, 189, 255, 0.2)",
      "background.button.agentHub.shadowActive": "0px 0px 40px 0px rgba(84, 90, 255, 0.3) inset",
      "background.button.agentHub.shadowDefault": "0px 0px 10px 0px rgba(84, 90, 255, 0.15) inset",
      "background.button.agentHub.shadowHover": "0px 0px 16px 0px rgba(84, 90, 255, 0.4) inset",
      "background.button.alarm.default": "#D71616",
      "background.button.alarm.disabled": "rgba(173, 175, 183, 1)",
      "background.button.alarm.hover": "#E74444",
      "background.button.alarm.pressed": "#C51111",
      "background.button.danger": "#D71616",
      "background.button.default": "rgba(61, 68, 86, 0.1)",
      "background.button.drawerMenu.default": "transparent",
      "background.button.drawerMenu.hover": "rgba(61, 68, 86, 0.05)",
      "background.button.drawerMenu.selected": "rgba(61, 68, 86, 0.1)",
      "background.button.iconCounter.pressed": "rgba(61, 68, 86, 0.2)",
      "background.button.iconLabelButton.default": "transparent",
      "background.button.iconLabelButton.disabled": "transparent",
      "background.button.iconLabelButton.hover": "rgba(61, 68, 86, 0.05)",
      "background.button.iconLabelButton.selected": "rgba(61, 68, 86, 0.1)",
      "background.button.magicAssistant": "rgba(244, 124, 255, 0.24)",
      "background.button.maxi.default": "rgba(196, 40, 221, 0.2)",
      "background.button.maxi.hover": "rgba(196, 40, 221, 0.3)",
      "background.button.maxi.pressed": "rgba(196, 40, 221, 0.1)",
      "background.button.neutral.default": "#006DD1",
      "background.button.neutral.disabled": "rgba(173, 175, 183, 1)",
      "background.button.neutral.hover": "#2783D8",
      "background.button.neutral.pressed": "#006DD1",
      "background.button.normal": "rgba(61, 68, 86, 0.1)",
      "background.button.positive.default": "#108D22",
      "background.button.positive.disabled": "rgba(173, 175, 183, 1)",
      "background.button.positive.hover": "#15A42A",
      "background.button.positive.pressed": "#108D22",
      "background.button.primary.default": "rgba(196, 40, 221, 1)",
      "background.button.primary.disabled": "rgba(173, 175, 183, 1)",
      "background.button.primary.hover": "rgba(244, 124, 255, 1)",
      "background.button.primary.pressed": "rgba(244, 124, 255, 1)",
      "background.button.secondary.default": "rgba(61, 68, 86, 0.1)",
      "background.button.secondary.disabled": "rgba(173, 175, 183, 1)",
      "background.button.secondary.hover": "rgba(61, 68, 86, 0.2)",
      "background.button.secondary.pressed": "rgba(61, 68, 86, 0.2)",
      "background.button.special.default": "rgba(245, 81, 249, 0.2)",
      "background.button.special.hover": "rgba(245, 81, 249, 0.3)",
      "background.button.special.pressed": "rgba(245, 81, 249, 0.1)",
      "background.button.tertiary.hover": "rgba(61, 68, 86, 0.1)",
      "background.button.tertiary.pressed": "rgba(61, 68, 86, 0.1)",
      "background.card.default": "#FFFFFF",
      "background.card.gradientDark": "linear-gradient(180deg, #FFFFFF 0%, rgba(255, 255, 255, 0) 100%)",
      "background.card.hover": "#FFFFFF",
      "background.card.hoverBorderGradient": "linear-gradient(0deg, #F7AEFF 0%, #F37DFF 100%)",
      "background.card.hoverShadow": "0px -3px 0.9375rem 0px rgba(225, 56, 255, 0.3)",
      "background.categoriesButton.selected.active": "rgba(99, 144, 254, 1)",
      "background.categoriesButton.selected.hover": "rgba(110, 177, 255, 1)",
      "background.categoryHeader": "rgba(248, 252, 255, 1)",
      "background.chatBkg": "#FAFAFA",
      "background.chatContinueBackground": "rgba(61, 68, 86, 0.1)",
      "background.codeMirrorEditor": "#FAFAFA",
      "background.conversation.hover": "rgba(61, 68, 86, 0.06)",
      "background.conversation.normal": "transparent",
      "background.conversation.selected": "rgba(99, 144, 254, 0.12)",
      "background.conversationBottomCover": "linear-gradient(180deg, rgba(255, 255, 255, 0) 0%, #FFFFFF 100%)",
      "background.conversationEditor": "rgba(225, 229, 233, 1)",
      "background.conversationStarters.default": " rgba(80, 161, 255, 0.2)",
      "background.conversationStarters.hover": " rgba(80, 161, 255, 0.4)",
      "background.conversationTopCover": "linear-gradient(360deg, rgba(255, 255, 255, 0) 0%, #FFFFFF 100%)",
      "background.dataGrid.main": "rgba(225, 229, 233, 1)",
      "background.dataGrid.row.selected": "rgba(196, 40, 221, 0.08)",
      "background.dataGrid.secondary": "rgba(250, 250, 250, 1)",
      "background.default": "rgba(248, 252, 255, 1)",
      "background.deprecated": "#D37015",
      "background.dragging": "rgba(99, 144, 254, 0.12)",
      "background.eliteaDefault": "linear-gradient(270deg, #EBF1F8 0%, #FFF9FF 100%)",
      "background.errorBkg": "rgba(215, 22, 22, 0.08)",
      "background.highlightUserMessage": " rgba(80, 161, 255, 0.2)",
      "background.icon.checkedBox": "#777A83",
      "background.icon.default": "rgba(61, 68, 86, 0.1)",
      "background.icon.entityBorderGradient": "linear-gradient(225deg, rgba(59, 66, 70, 0.1) 12.64%, rgba(59, 66, 70, 0.35) 87.88%)",
      "background.icon.entityGradient": "linear-gradient(45.36deg, rgba(119, 122, 124, 0.3) 16.25%, rgba(226, 226, 226, 0.3) 87.07%)",
      "background.icon.trophy": "#48433F",
      "background.imageAttachment": "linear-gradient(0deg, #FFFFFF 0%, rgba(255, 255, 255, 0) 100%)",
      "background.info": "rgba(106, 232, 250, 0.08)",
      "background.interactiveTourPrompt.backdrop": "rgba(59, 62, 70, 0.5)",
      "background.interactiveTourPrompt.borderGradient": "linear-gradient(186.77deg, #5194FF 5.31%, #A6DAFF 94.69%)",
      "background.interactiveTourPrompt.card": "linear-gradient(180deg, #EFF8FF 0%, #BAD1FF 100%)",
      "background.interactiveTourPrompt.counter": "rgba(92, 130, 191, 1)",
      "background.interactiveTourPrompt.dividerGradient": "linear-gradient(90deg, rgba(246, 142, 255, 0) 0%, #8DACFF 49.7%, rgba(246, 142, 255, 0) 100%)",
      "background.mcp.loginSuccess": "rgba(43, 212, 141, 0.08)",
      "background.mcp.logout": "rgba(233, 121, 18, 0.08)",
      "background.modal.simple": "#FFFFFF",
      "background.notificationList": "#FFFFFF",
      "background.onboarding": "linear-gradient(247.51deg, rgba(161, 197, 255, 0.6) 0.02%, rgba(161, 197, 255, 0.12) 50.21%, rgba(161, 214, 255, 0.6) 99.64%)",
      "background.onboardingBody": "rgba(250, 250, 250, 1)",
      "background.participant.active": "rgba(245, 81, 249, 0.1)",
      "background.participant.cover": "rgba(255, 255, 255, 0.5)",
      "background.participant.default": "rgba(61, 68, 86, 0.05)",
      "background.participant.hover": "rgba(61, 68, 86, 0.1)",
      "background.resourceCard.blue.borderGradient": "linear-gradient(180deg, rgba(0, 148, 255, 0.2) 0%, rgba(0, 148, 255, 0) 100%)",
      "background.resourceCard.blue.card": "linear-gradient(0deg, rgba(214, 235, 255, 0.4) 0%, #D6EBFF 100%)",
      "background.resourceCard.blue.divider": "rgba(0, 148, 255, 0.15)",
      "background.resourceCard.blue.icon": "linear-gradient(45.36deg, rgba(0, 148, 255, 0.3) 16.25%, rgba(0, 148, 255, 0.09) 87.07%)",
      "background.resourceCard.blue.iconBorderGradient": "linear-gradient(180deg, rgba(0, 148, 255, 0) 0%, rgba(0, 148, 255, 0.4) 100%)",
      "background.resourceCard.blue.iconColor": "#0094FF",
      "background.resourceCard.green.borderGradient": "linear-gradient(180deg, rgba(75, 186, 136, 0.2) 0%, rgba(75, 186, 136, 0) 100%)",
      "background.resourceCard.green.card": "linear-gradient(0deg, rgba(211, 251, 219, 0.4) 0%, #D3FBDB 100%)",
      "background.resourceCard.green.divider": "rgba(75, 186, 136, 0.15)",